CIP,NOMBRE,FECHAPROGRAMACION,MONTOPRESTAMO,NUMERO_DOCUMENTO,PERIODO_SOLICITUD,NUMERO_SOLICITUD,NUMERO_CUENTA,MONEDA,MONTO_PRESTAMO,SECTORISTA,FECHA_OTORGADO,FECHA_CANCELACION,PAGARE,EXPEDIENTE,FECHA_ENTREGA,FECHA_DEVOLUCION,TIPO_PRESTAMO,USUARIO_REGISTRO,OBSERVACION
35061,RACERJ INGENIEROS S.A.C,30/07/2014,"62,000.00",20171989044,2014,155004,3506111001,S,62000,CANDO SOBRINO BOLIVAR,30/07/2014,,PROTESTADO,CUSTODIADO,22/08/2017,,PEX-PRESTAMO EXTRAORDINARIO,MIGRA,Solicitado por correo J.Mesía
35099,"GONZALES VIGIL PINILLOS, SERGIO AURELIO",03/10/2015,"30,000.00",7803703,2015,155023,3509911001,S,30000,ASATO GUSUKUMA JORGE PAUL,03/10/2015,,CUSTODIADO,CUSTODIADO,,,PEX-PRESTAMO EXTRAORDINARIO,MIGRA,
32999,DTECH S.A.C.,12/11/2013,"500,000.00",20505582820,2013,153846,3299911001,D,500000,MIYAGUSUKU GARCIA ANTHONY ENRIQUE,12/11/2013,,CUSTODIADO,CUSTODIADO,,,PDD-PRESTAMO DESCUENTO DOCUMENTOS,MIGRA,
33001,ASATO YAGA CRISTINA NAOMI,19/02/2014,"1,500.00",47443673,2014,153850,3300112001,S,1500,"YAGUE YREY, CLARA INES",19/02/2014,,CUSTODIADO,CUSTODIADO,,,PLR-PRESTAMO PACICASH LINEA REVOLVE,MIGRA,
33153,"MIYAGUI MIYAGUI, MONICA MAYUMI",08/03/2016,"37,800.00",10373512,2016,153915,3315311001,S,37800,NAKASONE UECHI SILVIA MIKY,08/03/2016,,CUSTODIADO,CUSTODIADO,,,PSF-PRESTAMO SOLA FIRMA,MIGRA,
